{
  "schemaVersion": 1,
  "run": {
    "id": "17234891234",
    "attempt": 1,
    "url": "https://github.com/acme/webshop/actions/runs/17234891234",
    "status": "completed",
    "environment": {
      "id": "staging",
      "label": "Staging",
      "isProduction": false
    },
    "suiteLabel": "All tests",
    "triggeredBy": "m.bianchi",
    "startedAt": "2026-08-25T12:32:00.000Z",
    "finishedAt": "2026-08-25T12:38:12.000Z",
    "durationMs": 372000,
    "timezone": "Europe/Rome",
    "commit": {
      "sha": "a1b2c3d4e5f60718293a4b5c6d7e8f9012345678",
      "shortSha": "a1b2c3d",
      "branch": "main",
      "message": "Fix email validation in registration"
    }
  },
  "stats": {
    "total": 10,
    "passed": 5,
    "failed": 3,
    "flaky": 1,
    "skipped": 1,
    "passRate": 55.6,
    "durationMs": 372000
  },
  "areas": [
    {
      "id": "other",
      "label": "Other",
      "total": 1,
      "passed": 0,
      "failed": 1,
      "flaky": 0,
      "skipped": 0,
      "status": "broken"
    },
    {
      "id": "onboarding",
      "label": "Onboarding",
      "total": 3,
      "passed": 1,
      "failed": 2,
      "flaky": 0,
      "skipped": 0,
      "status": "broken"
    },
    {
      "id": "checkout",
      "label": "Checkout",
      "total": 3,
      "passed": 2,
      "failed": 0,
      "flaky": 1,
      "skipped": 0,
      "status": "degraded"
    },
    {
      "id": "billing",
      "label": "Billing",
      "total": 3,
      "passed": 2,
      "failed": 0,
      "flaky": 0,
      "skipped": 1,
      "status": "ok"
    }
  ],
  "tests": [
    {
      "id": "98c9a004",
      "title": "The service status page is reachable",
      "file": "tests/monitoring/status.spec.ts",
      "area": "other",
      "status": "failed",
      "durationMs": 340,
      "attempts": 1,
      "skipReason": null,
      "steps": null,
      "failedStepIndex": null,
      "error": {
        "category": "unknown",
        "human": null,
        "raw": "Error: Cannot find module '../helpers/status-client' imported from tests/monitoring/status.spec.ts",
        "location": {
          "file": "tests/monitoring/status.spec.ts",
          "line": 3
        }
      },
      "attachments": {
        "screenshot": null,
        "video": null,
        "trace": null
      }
    },
    {
      "id": "c38dc8e5",
      "title": "The customer invites a colleague to their workspace",
      "file": "tests/onboarding/invite.spec.ts",
      "area": "onboarding",
      "status": "failed",
      "durationMs": 12800,
      "attempts": 2,
      "skipReason": null,
      "steps": [
        {
          "index": 0,
          "title": "Test setup",
          "status": "failed",
          "durationMs": 12400
        }
      ],
      "failedStepIndex": 0,
      "error": {
        "category": "network",
        "human": "The server responded with an error during the test.",
        "raw": "Error: apiRequest.post: 503 Service Unavailable at https://staging.acme.internal/api/v2/workspaces",
        "location": {
          "file": "tests/onboarding/fixtures.ts",
          "line": 22
        }
      },
      "attachments": {
        "screenshot": null,
        "video": "test-results/onboarding-invite-chromium-retry1/video.webm",
        "trace": "test-results/onboarding-invite-chromium-retry1/trace.zip"
      }
    },
    {
      "id": "300f88f1",
      "title": "The new customer completes registration with a work email",
      "file": "tests/onboarding/registration.spec.ts",
      "area": "onboarding",
      "status": "failed",
      "durationMs": 62480,
      "attempts": 2,
      "skipReason": null,
      "steps": [
        {
          "index": 0,
          "title": "Opening the registration page",
          "status": "passed",
          "durationMs": 1200
        },
        {
          "index": 1,
          "title": "Entering personal details",
          "status": "passed",
          "durationMs": 2400
        },
        {
          "index": 2,
          "title": "Entering work email",
          "status": "passed",
          "durationMs": 800
        },
        {
          "index": 3,
          "title": "Submitting the form",
          "status": "passed",
          "durationMs": 1500
        },
        {
          "index": 4,
          "title": "Confirming the code via email",
          "status": "failed",
          "durationMs": 30000
        }
      ],
      "failedStepIndex": 4,
      "error": {
        "category": "timeout",
        "human": "The page did not respond within 30 seconds.",
        "raw": "TimeoutError: locator.click: Timeout 30000ms exceeded.\nCall log:\n  - waiting for getByRole('button', { name: 'Confirm code' })",
        "location": {
          "file": "tests/onboarding/registration.spec.ts",
          "line": 47
        }
      },
      "attachments": {
        "screenshot": "test-results/onboarding-registration-chromium-retry1/test-failed-1.png",
        "video": "test-results/onboarding-registration-chromium-retry1/video.webm",
        "trace": "test-results/onboarding-registration-chromium-retry1/trace.zip"
      }
    },
    {
      "id": "66e0aec5",
      "title": "The customer completes a purchase with a credit card",
      "file": "tests/checkout/purchase.spec.ts",
      "area": "checkout",
      "status": "flaky",
      "durationMs": 58200,
      "attempts": 2,
      "skipReason": null,
      "steps": [
        {
          "index": 0,
          "title": "Opening the product page",
          "status": "passed",
          "durationMs": 1800
        },
        {
          "index": 1,
          "title": "Adding to cart",
          "status": "passed",
          "durationMs": 1100
        },
        {
          "index": 2,
          "title": "Opening the order summary",
          "status": "passed",
          "durationMs": 900
        },
        {
          "index": 3,
          "title": "Entering card details",
          "status": "failed",
          "durationMs": 15200
        }
      ],
      "failedStepIndex": 3,
      "error": {
        "category": "elementNotFound",
        "human": "An expected element did not appear on the page.",
        "raw": "Error: locator.fill: Element is not attached to the DOM\nCall log:\n  - waiting for getByLabel('CVV')",
        "location": {
          "file": "tests/checkout/purchase.spec.ts",
          "line": 88
        }
      },
      "attachments": {
        "screenshot": "test-results/checkout-purchase-chromium/test-failed-1.png",
        "video": "test-results/checkout-purchase-chromium/video.webm",
        "trace": "test-results/checkout-purchase-chromium/trace.zip"
      }
    },
    {
      "id": "8fee513e",
      "title": "The administrator can download the monthly invoice register",
      "file": "tests/billing/register.spec.ts",
      "area": "billing",
      "status": "skipped",
      "durationMs": 0,
      "attempts": 1,
      "skipReason": "Only available from the third day of the month",
      "steps": null,
      "failedStepIndex": null,
      "error": null,
      "attachments": {
        "screenshot": null,
        "video": null,
        "trace": null
      }
    },
    {
      "id": "fa3bebde",
      "title": "The customer can empty the cart before paying",
      "file": "tests/checkout/cart.spec.ts",
      "area": "checkout",
      "status": "passed",
      "durationMs": 18400,
      "attempts": 1,
      "skipReason": null,
      "steps": null,
      "failedStepIndex": null,
      "error": null,
      "attachments": {
        "screenshot": null,
        "video": null,
        "trace": null
      }
    },
    {
      "id": "0b24a031",
      "title": "The customer receives the order confirmation email",
      "file": "tests/checkout/confirmation.spec.ts",
      "area": "checkout",
      "status": "passed",
      "durationMs": 26700,
      "attempts": 1,
      "skipReason": null,
      "steps": null,
      "failedStepIndex": null,
      "error": null,
      "attachments": {
        "screenshot": null,
        "video": null,
        "trace": null
      }
    },
    {
      "id": "0478e8f7",
      "title": "The invoice is generated as a PDF after payment",
      "file": "tests/billing/issuance.spec.ts",
      "area": "billing",
      "status": "passed",
      "durationMs": 51900,
      "attempts": 1,
      "skipReason": null,
      "steps": null,
      "failedStepIndex": null,
      "error": null,
      "attachments": {
        "screenshot": null,
        "video": null,
        "trace": null
      }
    },
    {
      "id": "1cd3ef2b",
      "title": "A credit note cancels the linked invoice",
      "file": "tests/billing/credit-note.spec.ts",
      "area": "billing",
      "status": "passed",
      "durationMs": 44300,
      "attempts": 1,
      "skipReason": null,
      "steps": null,
      "failedStepIndex": null,
      "error": null,
      "attachments": {
        "screenshot": null,
        "video": null,
        "trace": null
      }
    },
    {
      "id": "d65569ad",
      "title": "The customer updates their billing details from the profile",
      "file": "tests/onboarding/profile.spec.ts",
      "area": "onboarding",
      "status": "passed",
      "durationMs": 22900,
      "attempts": 1,
      "skipReason": null,
      "steps": null,
      "failedStepIndex": null,
      "error": null,
      "attachments": {
        "screenshot": null,
        "video": null,
        "trace": null
      }
    }
  ]
}
