{
  "schemaVersion": 1,
  "run": {
    "id": "17234880001",
    "attempt": 1,
    "url": "https://github.com/acme/webshop/actions/runs/17234880001",
    "status": "completed",
    "environment": {
      "id": "staging",
      "label": "Staging",
      "isProduction": false
    },
    "suiteLabel": "All tests",
    "triggeredBy": "m.bianchi",
    "startedAt": "2026-08-24T06:00:00.000Z",
    "finishedAt": "2026-08-24T06:03:41.000Z",
    "durationMs": 221000,
    "timezone": "Europe/Rome",
    "commit": {
      "sha": "9f1c4b7e2a8d5306fbc1e94a77d20e5583aa1c46",
      "shortSha": "9f1c4b7",
      "branch": "main",
      "message": "Update order confirmation page copy"
    }
  },
  "stats": {
    "total": 6,
    "passed": 6,
    "failed": 0,
    "flaky": 0,
    "skipped": 0,
    "passRate": 100,
    "durationMs": 221000
  },
  "areas": [
    {
      "id": "checkout",
      "label": "Checkout",
      "total": 2,
      "passed": 2,
      "failed": 0,
      "flaky": 0,
      "skipped": 0,
      "status": "ok"
    },
    {
      "id": "billing",
      "label": "Billing",
      "total": 2,
      "passed": 2,
      "failed": 0,
      "flaky": 0,
      "skipped": 0,
      "status": "ok"
    },
    {
      "id": "onboarding",
      "label": "Onboarding",
      "total": 2,
      "passed": 2,
      "failed": 0,
      "flaky": 0,
      "skipped": 0,
      "status": "ok"
    }
  ],
  "tests": [
    {
      "id": "1a2b3c4d",
      "title": "The customer completes a purchase with a credit card",
      "file": "tests/checkout/purchase.spec.ts",
      "area": "checkout",
      "status": "passed",
      "durationMs": 42100,
      "attempts": 1,
      "skipReason": null,
      "steps": null,
      "failedStepIndex": null,
      "error": null,
      "attachments": {
        "screenshot": null,
        "video": null,
        "trace": null
      }
    },
    {
      "id": "2b3c4d5e",
      "title": "The customer can empty the cart before paying",
      "file": "tests/checkout/cart.spec.ts",
      "area": "checkout",
      "status": "passed",
      "durationMs": 18400,
      "attempts": 1,
      "skipReason": null,
      "steps": null,
      "failedStepIndex": null,
      "error": null,
      "attachments": {
        "screenshot": null,
        "video": null,
        "trace": null
      }
    },
    {
      "id": "4d5e6f70",
      "title": "The administrator can download the monthly invoice register",
      "file": "tests/billing/register.spec.ts",
      "area": "billing",
      "status": "passed",
      "durationMs": 29800,
      "attempts": 1,
      "skipReason": null,
      "steps": null,
      "failedStepIndex": null,
      "error": null,
      "attachments": {
        "screenshot": null,
        "video": null,
        "trace": null
      }
    },
    {
      "id": "3c4d5e6f",
      "title": "The invoice is generated as a PDF after payment",
      "file": "tests/billing/issuance.spec.ts",
      "area": "billing",
      "status": "passed",
      "durationMs": 51900,
      "attempts": 1,
      "skipReason": null,
      "steps": null,
      "failedStepIndex": null,
      "error": null,
      "attachments": {
        "screenshot": null,
        "video": null,
        "trace": null
      }
    },
    {
      "id": "6f708192",
      "title": "The customer invites a colleague to their workspace",
      "file": "tests/onboarding/invite.spec.ts",
      "area": "onboarding",
      "status": "passed",
      "durationMs": 31500,
      "attempts": 1,
      "skipReason": null,
      "steps": null,
      "failedStepIndex": null,
      "error": null,
      "attachments": {
        "screenshot": null,
        "video": null,
        "trace": null
      }
    },
    {
      "id": "5e6f7081",
      "title": "The new customer completes registration with a work email",
      "file": "tests/onboarding/registration.spec.ts",
      "area": "onboarding",
      "status": "passed",
      "durationMs": 47300,
      "attempts": 1,
      "skipReason": null,
      "steps": null,
      "failedStepIndex": null,
      "error": null,
      "attachments": {
        "screenshot": null,
        "video": null,
        "trace": null
      }
    }
  ]
}
